Date,Event,Description
2025-05-06,Registration Opens,"Team registration opens for the 2025‑26 UNEARTHED season; early bird for FLL Explore."
2025-08-05,UNEARTHED Season Kickoff,"Official release of the 2025‑26 FIRST LEGO League Explore season; challenge set and resources available."
2025-10-31,Registration Deadline,"Suggested deadline for team registration and event sign‑ups (varies by region)."
2025-12-01,Start Team Meetings,"Begin weekly team meetings to explore the theme, build models, and prepare for the festival."
2026-03-01,Submission Window Opens,"Local and virtual festival submission window opens; confirm your local affiliate’s deadline."
2026-05-31,Festival Window Ends,"Final opportunities to present at a local or virtual festival before the season concludes."